Pubmed_ID,Review,Author,Title,Journal,Year,Subject,Species,Nr patients,abstract
11401914,No," L A Mooney, K Frenkel",Gender differences in autoantibodies to oxidative DNA base damage in cigarette smokers.,"Cancer epidemiology, biomarkers & prevention : a publication of the American Association for Cancer Research, cosponsored by the American Society of Preventive Oncology",2001 Jun,Pathophysiology,Human,140,"Oxidative DNA damage and antibodies to that damage have been implicated in lung, breast, and colorectal cancer. In this observational validation study, the relationship between anti-5-hydroxymethyl-2'-deoxyuridine (HMdU) autoantibody (aAb) and plasma micronutrients was assessed in 140 heavy smokers by ELISA. Anti-HMdU aAbs were 50% higher in women after adjustment for cigarettes/day (CPD; P = 0.002), although men smoked more and had higher plasma cotinine levels. The women reported taking more vitamin C (P < 0.005) and had higher plasma levels of alpha-carotene and beta-carotene (P < 0.001) and cryptoxanthin (P < 0.01) than men. Neither CPD nor cotinine was associated with aAb titers. Anti-HMdU aAbs were associated inversely with alpha-tocopherol (P = 0.10), retinol (P = 0.06), and age (P = 0.04) in women but not in men. In contrast to the men, women <or=50 years of age had significantly higher aAbs than those >50 years of age (P = 0.05). Given the same duration of exposure, women had higher anti-HMdU aAbs and also reached peak levels at a lower cumulative smoking exposure (30 years) compared with male smokers (40 years). Subjects smoked an average of 28.9 +/- 0.81 CPD and initiated smoking at 17.2 +/- 0.33 (SE) years of age. Therefore, smokers who reported smoking for 30 years were typically <50 years old. Women <or=50 years in the younger age group that smoked 21-30 years had significantly higher levels of aAbs than did men of the same age and smoking history (P = 0.012). Gender difference in aAbs was also evident in 29 persons who gave serial samples before and after quitting smoking (P < 0.028). In women, aAbs remained elevated for 14 months after smoking cessation but decreased significantly by 20.5 months (P < 0.032) by paired t tests. In men, aAbs increased with time since quitting smoking but not significantly. The finding of significantly elevated aAbs to oxidized DNA in females <or=50 compared with male smokers of the same age and exposure suggests a possible interaction with hormones (e.g., estrogens) and may explain a heightened risk of smoking-induced lung cancer in women compared with men."
11432709,No," X Li,","Gender-specific incidence trends in lung cancer by histological type in Sweden, 1958-1996.",European journal of cancer prevention : the official journal of the European Cancer Prevention Organisation (ECP),2001 Jun,Epidemiology,Human,45297,"We used the Swedish Family-Cancer Database to examine the time trends of lung cancer in Sweden by histological type, with special reference to gender. A total of 45,297 lung cancer cases were analysed. The overall age-adjusted incidence rates of squamous cell carcinoma (SCC) in men peaked in the 1980s and then slightly decreased, while corresponding rates in women increased steadily. The incidence of adenocarcinoma increased in both genders. The male-to-female incidence ratio for SCC was 12.4 in the 1960s and 3.6 in the 1990s. For adenocarcinoma the ratio was close to 1.5 throughout the period. Regression analysis indicated that the birth cohort of the 1940s was at the highest risk for adenocarcinoma in men and for all types of lung cancer in women. Lung cancer in parents was a risk factor for offspring. In conclusion, the data, particularly on women, suggest that modern cigarettes induce lung adenocarcinoma and SCC in a proportion of 1:0.6. This proportion was 1:3.7 among men diagnosed in the 1960s. The incidence ratio of 1.3 for adenocarcinoma between men and women in the 1990s is consistent with the smoking prevalence data a few decades ago, suggesting equal sensitivity of both genders to tobacco-induced lung cancer."
11401914,No," L A Mooney,",Gender differences in autoantibodies to oxidative DNA base damage in cigarette smokers.,"Cancer epidemiology, biomarkers & prevention : a publication of the American Association for Cancer Research, cosponsored by the American Society of Preventive Oncology",2001 Jun,Pathophysiology,Human,140,"Oxidative DNA damage and antibodies to that damage have been implicated in lung, breast, and colorectal cancer. In this observational validation study, the relationship between anti-5-hydroxymethyl-2'-deoxyuridine (HMdU) autoantibody (aAb) and plasma micronutrients was assessed in 140 heavy smokers by ELISA. Anti-HMdU aAbs were 50% higher in women after adjustment for cigarettes/day (CPD; P = 0.002), although men smoked more and had higher plasma cotinine levels. The women reported taking more vitamin C (P < 0.005) and had higher plasma levels of alpha-carotene and beta-carotene (P < 0.001) and cryptoxanthin (P < 0.01) than men. Neither CPD nor cotinine was associated with aAb titers. Anti-HMdU aAbs were associated inversely with alpha-tocopherol (P = 0.10), retinol (P = 0.06), and age (P = 0.04) in women but not in men. In contrast to the men, women <or=50 years of age had significantly higher aAbs than those >50 years of age (P = 0.05). Given the same duration of exposure, women had higher anti-HMdU aAbs and also reached peak levels at a lower cumulative smoking exposure (30 years) compared with male smokers (40 years). Subjects smoked an average of 28.9 +/- 0.81 CPD and initiated smoking at 17.2 +/- 0.33 (SE) years of age. Therefore, smokers who reported smoking for 30 years were typically <50 years old. Women <or=50 years in the younger age group that smoked 21-30 years had significantly higher levels of aAbs than did men of the same age and smoking history (P = 0.012). Gender difference in aAbs was also evident in 29 persons who gave serial samples before and after quitting smoking (P < 0.028). In women, aAbs remained elevated for 14 months after smoking cessation but decreased significantly by 20.5 months (P < 0.032) by paired t tests. In men, aAbs increased with time since quitting smoking but not significantly. The finding of significantly elevated aAbs to oxidized DNA in females <or=50 compared with male smokers of the same age and exposure suggests a possible interaction with hormones (e.g., estrogens) and may explain a heightened risk of smoking-induced lung cancer in women compared with men."
11444848,No," Y Omoto, S I Hayashi","Expression, function, and clinical implications of the estrogen receptor beta in human lung cancers.",Biochemical and biophysical research communications,2001 Jul 13,Pathophysiology,Human,na,"The higher frequency of human lung adenocarcinoma in females than in males, strongly suggests the involvement of gender dependent factors in the etiology of this disease. This is the first investigation of estrogen receptor (ER) beta in human lung. Immunohistochemical staining revealed ERbeta expression in normal lung and in atypical adenomatous hyperplasia (AAH), considered as a precancerous lesion for adenocarcinomas. Adenocarcinomas showed significantly higher expression of ERbeta than squamous cell carcinomas. On the contrary, ERalpha expression was not detected in all cases. The functional integrity of ERbeta such as the binding ability to estrogen responsive element (ERE) and transcriptional activity was confirmed using a human lung cancer cell line, RERF-LC-OK. Colony formation of this cell was significantly reduced in the presence of pure antiestrogen. We conclude that ERbeta, but not ERalpha, is present in lung tissues with an important physiological function in normal lung. Furthermore, ERbeta may play a role in growth and development of adenocarcinomas."
11444848,No," Y Omoto,","Expression, function, and clinical implications of the estrogen receptor beta in human lung cancers.",Biochemical and biophysical research communications,2001 Jul 13,Pathophysiology,Human,n.a.,"The higher frequency of human lung adenocarcinoma in females than in males, strongly suggests the involvement of gender dependent factors in the etiology of this disease. This is the first investigation of estrogen receptor (ER) beta in human lung. Immunohistochemical staining revealed ERbeta expression in normal lung and in atypical adenomatous hyperplasia (AAH), considered as a precancerous lesion for adenocarcinomas. Adenocarcinomas showed significantly higher expression of ERbeta than squamous cell carcinomas. On the contrary, ERalpha expression was not detected in all cases. The functional integrity of ERbeta such as the binding ability to estrogen responsive element (ERE) and transcriptional activity was confirmed using a human lung cancer cell line, RERF-LC-OK. Colony formation of this cell was significantly reduced in the presence of pure antiestrogen. We conclude that ERbeta, but not ERalpha, is present in lung tissues with an important physiological function in normal lung. Furthermore, ERbeta may play a role in growth and development of adenocarcinomas."
11511603,No," P J Marang-van de Mheen, D J Hole",Are women more sensitive to smoking than men? Findings from the Renfrew and Paisley study.,International journal of epidemiology,2001 Aug,Outcomes,Human,na,"Prescott et al. found that the relative risks associated with smoking for respiratory and vascular deaths were higher for women who inhale than for inhaling men, and found no gender differences in relative risks of smoking-related cancers. The purpose of the present study was to assess whether these findings are reproducible, using data from the Renfrew and Paisley study.Age-standardized mortality rate differences and age-adjusted mortality rate ratios (using Cox's proportional hazard model) were calculated for male and female smokers by amount smoked compared with never smokers. These analyses were repeated after excluding non-inhalers.The all-cause mortality rate ratio was higher for men than for women in all categories of amount smoked, although this difference was only statistically significant in the light smokers (1.83 [95% CI : 1.61-2.07] for men and 1.41 [95% CI : 1.28-1.56] for women, P = 0.001). The cause-specific mortality rate ratios tended to be higher for men than for women, and this difference was most substantial for neoplasms (2.57 [95% CI : 2.01-3.29] for male light smokers and 1.35 [95% CI : 1.14-1.61] for female light smokers, P < 0.001) and, in particular, for lung cancer (11.10 [95% CI : 5.89-20.92] for male light smokers and 4.73 [95% CI : 2.99-7.50] for female light smokers, P = 0.03). Furthermore, looking at the rate differences the effects of smoking were uniformly greater in men than in women. These results were virtually unchanged after excluding non-inhalers.We found similar results to Prescott et al. when all smokers were considered, but could not reproduce their findings when non-inhalers were excluded. Given the fact that we showed greater rate differences in men than in women, we think that it is too early to conclude that women may be more sensitive than men to some of the deleterious effects of smoking."
11519762,No," G Myrdal,",Trends in lung cancer incidence in Sweden with special reference to period and birth cohorts.,Cancer causes & control : CCC,2001 Aug,Epidemiology,Human,n.a.,"Sweden has one of the largest population-based cancer registers in the world that provides an opportunity to examine the trend of lung cancer incidence during a 35-year period. The primary aim of the present study was to estimate the effects of birth cohort, year of diagnosis (period), and age on the time trends of lung cancer incidence rates, and to analyze the gender-specific incidence of different histopathological types of lung cancer.Among men the age-standardized incidence rate increased steadily up to 1982, when a peak of 49 cases per 100,000 person-years was reached. Among women the incidence rate was lower and showed a monotonic increase throughout the observation period. The fastest rate of increase was noted among the youngest women. In women, but not in men, there was a steady increase in risk with each successive birth cohort. For both sexes there were large changes in the histopathological distributions of cases. The most notable was a major increase in adenocarcinomas.The overall age-adjusted incidence rate of lung cancer in Sweden has stabilized in men during the past two decades while rates are still increasing in women. In view of the continued high prevalence of smoking among young women, a future definite increase in the overall number of lung cancer cases in women can be expected."
11511603,No," P J Marang-van de Mheen,",Are women more sensitive to smoking than men? Findings from the Renfrew and Paisley study.,International journal of epidemiology,2001 Aug,Outcomes,Human,n.a.,"Prescott et al. found that the relative risks associated with smoking for respiratory and vascular deaths were higher for women who inhale than for inhaling men, and found no gender differences in relative risks of smoking-related cancers. The purpose of the present study was to assess whether these findings are reproducible, using data from the Renfrew and Paisley study.Age-standardized mortality rate differences and age-adjusted mortality rate ratios (using Cox's proportional hazard model) were calculated for male and female smokers by amount smoked compared with never smokers. These analyses were repeated after excluding non-inhalers.The all-cause mortality rate ratio was higher for men than for women in all categories of amount smoked, although this difference was only statistically significant in the light smokers (1.83 [95% CI : 1.61-2.07] for men and 1.41 [95% CI : 1.28-1.56] for women, P = 0.001). The cause-specific mortality rate ratios tended to be higher for men than for women, and this difference was most substantial for neoplasms (2.57 [95% CI : 2.01-3.29] for male light smokers and 1.35 [95% CI : 1.14-1.61] for female light smokers, P < 0.001) and, in particular, for lung cancer (11.10 [95% CI : 5.89-20.92] for male light smokers and 4.73 [95% CI : 2.99-7.50] for female light smokers, P = 0.03). Furthermore, looking at the rate differences the effects of smoking were uniformly greater in men than in women. These results were virtually unchanged after excluding non-inhalers.We found similar results to Prescott et al. when all smokers were considered, but could not reproduce their findings when non-inhalers were excluded. Given the fact that we showed greater rate differences in men than in women, we think that it is too early to conclude that women may be more sensitive than men to some of the deleterious effects of smoking."
11238578,No," J Benach,",Material deprivation and leading causes of death by gender: evidence from a nationwide small area study.,Journal of epidemiology and community health,2001 Apr,Epidemiology,Human,n.a.,"To investigate the association between material deprivation and 10 leading causes of death by gender.Small area cross sectional ecological study using two dimensions of material deprivation (Index 1 and Index 2) drawn from 1991 census and cause specific mortality data aggregated for 1987-1995.2218 small areas in Spain.Strong detrimental associations of two deprivation indices were found with top six leading causes of death for men and top seven leading causes of death for women, except breast cancer. For men, the highest percentages of excess mortality (between 40% and 60%) were found for smoking and alcohol related causes of death such as lung cancer, chronic obstructive pulmonary diseases, and cirrhosis while for women the highest percentages of excess mortality (between 40% and 60%) were found for diet related causes such as diabetes and ischaemic heart disease.Health inequality is a widespread phenomenon in the majority of the top leading causes of deaths of the nation. Increasing levels of deprivation indices are associated with mortality risk differently by both cause and gender. Results suggest that deprivation effects mainly captured by Index 2 may manifest largely as unfavourable health behaviours leading to gender specific sets of causes of deaths. Findings of this study are consistent with the idea that material deprivation determines health inequality through both an increase of general susceptibility to ill health, leading to excess mortality in a wide range of causes, and a set of specific factors, resulting in an increased risk of death from a specific set of causes in each gender."
11424180,No," Y W Cheng, H Lee",Gender difference in DNA adduct levels among nonsmoking lung cancer patients.,Environmental and molecular mutagenesis,2001,Pathophysiology,Human,82,"Lung cancer is the leading cause of cancer mortality in Taiwanese women. Cigarette smoking cannot explain the high lung cancer mortality in this population because less than 10% of women in Taiwan are smokers. Therefore, environmental factors other than smoking may play an important role in lung cancer development in female nonsmokers. The purpose of this study was to elucidate the role of environmental carcinogen exposure in lung cancer development in Taiwanese female nonsmokers, based on DNA adduct formation. We collected nontumorous lung tissues resected from 62 nonsmoking lung cancer patients and 20 noncancer controls to investigate whether differences in susceptibility to DNA adduct formation exist between men and women. (32)P-postlabeling and ELISA (enzyme-linked immunosorbent assay) with polyclonal antibody against BPDE (7,8-dihydroxy-anti-9,10-epoxy-7,8,9,10-tetrahydrobenzo[a]pyrene)-DNA adduct were used to evaluate DNA adduct levels in lung tissues of study subjects. Our data showed that the DNA adduct levels of lung cancer patients determined by both assays were significantly higher than those of noncancer controls (P = 0.0001 for (32)P-postlabeling; P = 0.01 for ELISA). Moreover, DNA adduct levels in females were markedly greater than those in males (P = 0.014 for (32)P-postlabeling; P = 0.001 for ELISA). The difference in DNA adduct levels could not be explained by genetic polymorphisms of cytochrome P-4501A1 (CYP1A1) or glutathione S-transferase (GSTM1), as determined by polymerase chain reaction and restriction fragment length polymorphism. These results demonstrate that lung cancer patients have a higher susceptibility to DNA damage than that of noncancer controls. In addition, differences in susceptibility to DNA damage derived from environmental carcinogen exposure were observed between male and female nonsmokers. In conclusion, high susceptibility to DNA damage in females may partially explain the high mortality rate of lung cancer in nonsmoking Taiwanese women."
11424180,No," Y W Cheng,",Gender difference in DNA adduct levels among nonsmoking lung cancer patients.,Environmental and molecular mutagenesis,2001,Pathophysiology,Human,82,"Lung cancer is the leading cause of cancer mortality in Taiwanese women. Cigarette smoking cannot explain the high lung cancer mortality in this population because less than 10% of women in Taiwan are smokers. Therefore, environmental factors other than smoking may play an important role in lung cancer development in female nonsmokers. The purpose of this study was to elucidate the role of environmental carcinogen exposure in lung cancer development in Taiwanese female nonsmokers, based on DNA adduct formation. We collected nontumorous lung tissues resected from 62 nonsmoking lung cancer patients and 20 noncancer controls to investigate whether differences in susceptibility to DNA adduct formation exist between men and women. (32)P-postlabeling and ELISA (enzyme-linked immunosorbent assay) with polyclonal antibody against BPDE (7,8-dihydroxy-anti-9,10-epoxy-7,8,9,10-tetrahydrobenzo[a]pyrene)-DNA adduct were used to evaluate DNA adduct levels in lung tissues of study subjects. Our data showed that the DNA adduct levels of lung cancer patients determined by both assays were significantly higher than those of noncancer controls (P = 0.0001 for (32)P-postlabeling; P = 0.01 for ELISA). Moreover, DNA adduct levels in females were markedly greater than those in males (P = 0.014 for (32)P-postlabeling; P = 0.001 for ELISA). The difference in DNA adduct levels could not be explained by genetic polymorphisms of cytochrome P-4501A1 (CYP1A1) or glutathione S-transferase (GSTM1), as determined by polymerase chain reaction and restriction fragment length polymorphism. These results demonstrate that lung cancer patients have a higher susceptibility to DNA damage than that of noncancer controls. In addition, differences in susceptibility to DNA damage derived from environmental carcinogen exposure were observed between male and female nonsmokers. In conclusion, high susceptibility to DNA damage in females may partially explain the high mortality rate of lung cancer in nonsmoking Taiwanese women."
11253230,No, K G Manton,"Gender differences in the cross-sectional and cohort age dependence of cause-specific mortality: the United States, 1962 to 1995.",The journal of gender-specific medicine : JGSM : the official journal of the Partnership for Women's Health at Columbia,2000 May-Jun,Epidemiology,Human,na,"Gender- and age-specific mortality rates were calculated to determine the role of behavioral and biologically based differences in health.Changes in age-specific mortality rates were calculated for males and females across select time periods, in addition to gender- and cause-specific mortality age trajectories for birth cohorts for heart disease, stroke, and lung and breast cancer. Differences between cohort mortality age trajectories and the age pattern of mortality rates were related to socioeconomic differences between genders and to biological risk factors.U.S. males and females aged 30 to 95+ over the 34-year period 1962 to 1995.Gender- and age-specific mortality rates were computed and displayed using the logarithmic transform of the rates for five-year age categories.Major gender cross-sectional mortality differences were found for heart disease, stroke, and lung cancer, with males being disadvantaged except for stroke. Less variation was found for lung cancer in recent male cohorts compared to large rates of change for recent female cohorts. Female breast cancer mortality showed modest variation, with most of the cohort differential in risk in postmenopausal breast cancer risk. Relative risk of lung cancer with age was greater for females.Differences in male and female cohort mortality rates underlie many of the period changes for heart disease, stroke, and lung cancer. Cohort differences were largest for lung cancer, although the cohort-specific smoking patterns these rates imply could also be responsible for some of the heart disease and mortality differences. The breast cancer mortality rates showed consistency with the concept of two distinct etiologies for breast cancer: premenopausal and postmenopausal. Large cohort increases in female lung cancer mortality may be alterable by behavioral measures and education."
11253230,No," K G Manton,","Gender differences in the cross-sectional and cohort age dependence of cause-specific mortality: the United States, 1962 to 1995.",The journal of gender-specific medicine : JGSM : the official journal of the Partnership for Women's Health at Columbia,2000 May-Jun,Epidemiology,Human,n.a.,"Gender- and age-specific mortality rates were calculated to determine the role of behavioral and biologically based differences in health.Changes in age-specific mortality rates were calculated for males and females across select time periods, in addition to gender- and cause-specific mortality age trajectories for birth cohorts for heart disease, stroke, and lung and breast cancer. Differences between cohort mortality age trajectories and the age pattern of mortality rates were related to socioeconomic differences between genders and to biological risk factors.U.S. males and females aged 30 to 95+ over the 34-year period 1962 to 1995.Gender- and age-specific mortality rates were computed and displayed using the logarithmic transform of the rates for five-year age categories.Major gender cross-sectional mortality differences were found for heart disease, stroke, and lung cancer, with males being disadvantaged except for stroke. Less variation was found for lung cancer in recent male cohorts compared to large rates of change for recent female cohorts. Female breast cancer mortality showed modest variation, with most of the cohort differential in risk in postmenopausal breast cancer risk. Relative risk of lung cancer with age was greater for females.Differences in male and female cohort mortality rates underlie many of the period changes for heart disease, stroke, and lung cancer. Cohort differences were largest for lung cancer, although the cohort-specific smoking patterns these rates imply could also be responsible for some of the heart disease and mortality differences. The breast cancer mortality rates showed consistency with the concept of two distinct etiologies for breast cancer: premenopausal and postmenopausal. Large cohort increases in female lung cancer mortality may be alterable by behavioral measures and education."
