Pubmed_ID,Review,Author,Title,Journal,Year,Subject,Species,Nr patients,abstract
19995649,Yes," Seema Harichand-Herdt,",Gender-associated differences in lung cancer: clinical characteristics and treatment outcomes in women.,Seminars in oncology,2009 Dec,Review,Human,na,"Lung cancer is the leading cause of cancer deaths in the United States. In recent years the incidence of lung cancer in men has been declining, while in women it has been increasing. A number of population-based studies have demonstrated gender-based differences in clinical and pathologic factors, as well as in survival related to lung cancer. Disparities in age, smoking practices, and histological subtypes are among the differences that have been identified. Gender disparity also has been observed in outcomes, with improved survival observed for women in a number of clinical trials. This article reviews the gender-related differences in clinical and pathologic factors and outcomes of patients with lung cancer observed in population-based studies and clinical trials."
19995648,Yes," Rowan T Chlebowski,","Menopausal hormone therapy, hormone receptor status, and lung cancer in women.",Seminars in oncology,2009 Dec,Review,Human,na,"Gender differences in lung cancer incidence and outcome suggest a potential role for reproductive hormones. However, observational studies regarding menopausal hormone therapy use and lung cancer have given mixed results. Some have associated hormone therapy use with increased lung cancer risk, while others have shown no effect or found lower lung cancer risk in hormone therapy users. Against this background the Women's Health Initiative (WHI) randomized controlled trial evaluating conjugated equine estrogen (CEE) and medroxyprogesterone acetate (MPA) in postmenopausal women identified an increase in malignancies in the hormone therapy group during the post intervention period. Post hoc analyses identified a statistically significant increase in deaths from lung cancer for women in the hormone group largely related to effects on non-small cell lung cancer (NSCLC). The NSCLCs were more commonly poorly differentiated and were diagnosed at a metastatic stage, suggesting a hormone effect on already established lung cancer growth. Ongoing preclinical and clinical analyses have identified estrogen receptors in the nucleus and cytoplasm of lung tissue and lung cancers. More recently, intriguing associations among estrogen receptor expression, lung cancer histology, clinical prognosis, and epidermal growth factor receptor (EGFR) mutations have been reported. The WHI clinical findings should be integrated into risk-benefit discussion with women considering combined hormone therapy use. In addition, the findings, together with ongoing studies evaluating estrogen receptor status and function, support further efforts to develop lung cancer intervention strategies targeting estrogen receptor expression."
19995645,Yes," Danielle Shafer,",Lung cancer outcomes in women.,Seminars in oncology,2009 Dec,Review,Human,na,"Lung cancer remains the leading cause of cancer death in men and women. Since the 1970s, there has been evidence for improved survival of women with lung cancer compared to men. Multiple analyses have demonstrated a survival advantage in women regardless of stage, histology, or treatment. The etiology for the improved prognosis is not yet fully elucidated, but is likely related to underlying biologic differences, including hormonal interactions. More recently, gender differences in response to newer agents such as epidermal growth factor receptor inhibitors and anti-angiogenesis agents have been identified. Further exploration of tumor molecular, biologic, hormonal, and pharmacogenomic interactions may provide additional insight into the observed survival benefit for women and, ultimately, permit exploitation of these differences in our treatment selection for both women and men."
19995647,Yes," David Planchard,",Differential expression of biomarkers in men and women.,Seminars in oncology,2009 Dec,Review,Human,na,"Lung cancer is one of the most common cancers in the world. While historically, more men than women have died from lung cancer as a result of higher numbers of male smokers, the sex mortality ratio is now showing signs of narrowing. Tumors in women with lung cancer may be slightly different to those in men with lung cancer. This review focuses on biomarkers differentially expressed between female and male patients with lung cancer. There is variation in gene expression between men and women in some genes that encode carcinogen-metabolizing enzymes (CYP1A1, GSTM). Gastrin-releasing peptide (GRP), a bombesin-like peptide, is present in two actively transcribed alleles in women compared with men. Higher prevalence of infection with oncogenic variants human papilloma viruses (HPVs) HPV16 and HPV18 has been suggested in women. A higher frequency of G to T transversion was found in the p53 gene in lung tumors of women. KRAS mutation was found to be more frequent in women with resected non-small cell lung cancer (NSCLC) than in men with resected NSCLC. Epidermal growth factor receptor (EGFR) mutation is more frequently found in lung tumors from women, but the confounding effect of tobacco exposure may explain this difference. Lower levels of ERCC1 and BRCA1 have been reported in women with NSCLC. Lung tumors from women are more likely to express estrogen receptors than those from men. An in silico analysis of transcriptome datasets from lung cancer patients demonstrated that only seven genes (in at least two studies) had significantly different expression patterns in male versus female patients. All of these genes are localized on the sex chromosomes: one on chromosome X and six on chromosome Y. Many areas remain under debate and there are still significant gaps in our understanding, particularly how sex-linked factors relate to lung cancer risk, and to biological and clinical behaviors. Future research into lung cancer needs to address these gender differences more specifically."
20477352,Yes," Maria Patricia Rivera,","Lung cancer in women: the differences in epidemiology, biology and treatment outcomes.",Expert review of respiratory medicine,2009 Dec,Review,Human,n.a.,"Although the prevalence of lung cancer in men has been decreasing, it has been increasing in women. Without a doubt, lung cancer is a major health problem for women in the USA, not only owing to its high incidence rate but, more alarming, the high mortality rate. Lung cancer kills more women each year than breast, ovarian and uterine cancers combined. One of the most important risk factors for the development of lung cancer in both men and women is cigarette smoking. Unfortunately, the prevalence of smoking among women has increased significantly since 1980, which is a major concern as epidemiologic data suggest that women may be more susceptible to developing lung cancer than men. Many will argue, however, that after adjusting for tobacco exposure, some studies have failed to show that women are at a higher risk for developing lung cancer. Indeed, the increased risk of lung cancer in women remains controversial. There is, however, little controversy to the fact that the biology of lung cancer differs between the sexes. This paper summarizes the explanations for the sex differences in lung cancer, including differences in molecular abnormalities, growth factor receptors, hormonal influences, differences in cytochrome P-450 enzymes and DNA repair capacity, as well as variations in treatment outcomes."
19327500,No," Jee Won Chang, Shun-ichi Watanabe",Gender difference in survival of resected non-small cell lung cancer: histology-related phenomenon?,The Journal of thoracic and cardiovascular surgery,2009 Apr,Outcomes,Human,2770,"It remains controversial whether there is a gender difference in survival of patients with resected non-small cell lung cancer.We retrospectively analyzed 2770 patients (1689 men and 1081 women) with non-small cell lung cancer who underwent pulmonary resection between 1995 and 2005 at the National Cancer Center Hospital, Tokyo. A gender difference in survival was studied in all patients, in those divided according to histology or pathologic stage, and in propensity-matched gender pairs.There were no differences in background, such as preoperative pulmonary function, operation procedures, or operative mortality. The proportions of adenocarcinoma and pathologic stage I in women were greater than those in men (93.6% vs 61.7% and 71.4% vs 58.6%, respectively) (P < .001). Overall 5-year survival of women was better than that of men (81% vs 70%, P < .001). In adenocarcinoma, the overall 5-year survival for women was better than that for men in pathologic stage I (95% vs 87%, P < .001) and in pathologic stage II or higher (58% vs 51%, P = .017). In non-adenocarcinoma, there was no significant gender difference in survival in pathologic stage I (P = .313) or pathologic stage II or higher (P = .770). The variables such as age, smoking status, histology, and pathologic stage were used for propensity score matching, and survival analysis of propensity score-matched gender pairs did not show a significant difference (P = .69).Women had better survival than men; however, there was no survival advantage in propensity-matched gender pairs. A gender difference in survival was observed only in the adenocarcinoma subset, suggesting pathobiology in adenocarcinoma in women might be different from that of men."
19327500,No," Jee Won Chang,",Gender difference in survival of resected non-small cell lung cancer: histology-related phenomenon?,The Journal of thoracic and cardiovascular surgery,2009 Apr,Outcomes,Human,2770,"It remains controversial whether there is a gender difference in survival of patients with resected non-small cell lung cancer.We retrospectively analyzed 2770 patients (1689 men and 1081 women) with non-small cell lung cancer who underwent pulmonary resection between 1995 and 2005 at the National Cancer Center Hospital, Tokyo. A gender difference in survival was studied in all patients, in those divided according to histology or pathologic stage, and in propensity-matched gender pairs.There were no differences in background, such as preoperative pulmonary function, operation procedures, or operative mortality. The proportions of adenocarcinoma and pathologic stage I in women were greater than those in men (93.6% vs 61.7% and 71.4% vs 58.6%, respectively) (P < .001). Overall 5-year survival of women was better than that of men (81% vs 70%, P < .001). In adenocarcinoma, the overall 5-year survival for women was better than that for men in pathologic stage I (95% vs 87%, P < .001) and in pathologic stage II or higher (58% vs 51%, P = .017). In non-adenocarcinoma, there was no significant gender difference in survival in pathologic stage I (P = .313) or pathologic stage II or higher (P = .770). The variables such as age, smoking status, histology, and pathologic stage were used for propensity score matching, and survival analysis of propensity score-matched gender pairs did not show a significant difference (P = .69).Women had better survival than men; however, there was no survival advantage in propensity-matched gender pairs. A gender difference in survival was observed only in the adenocarcinoma subset, suggesting pathobiology in adenocarcinoma in women might be different from that of men."
21188124,No," Aminah Jatoi,",Is social support associated with improved clinical outcomes in geriatric lung cancer patients? Observations from North Central Cancer Treatment Group Studies N9921 and N0222.,Cancer management and research,2009,Outcomes,Human,113,"Social support is defined as a network of family/friends who provide practical and emotional help. A sizable literature describes a direct relationship between social support and improved cancer clinical outcomes. This study explored the extent of social support and its potential association with survival and adverse events in geriatric lung cancer patients.One hundred thirteen patients, who were aged 65 years or older, had incurable cancer, and were enrolled in one of two chemotherapy trials, completed the Lubben Social Network Scale, a validated instrument that measures social support. All were followed for survival and chemotherapy-related adverse events.The median age (range) of the cohort was 74 years (65-91), and performance scores of 0, 1, or 2 were observed in 29%, 55%, and 16%, respectively. Forty-two percent were women. This cohort had a high level of social support: 81% reported they ""always"" had someone to take them to medical appointments. However, there were no gender-based differences in social support and no associations between social support and either survival or adverse events.In this cohort of geriatric lung cancer patients - all of whom were treated during a clinical trial - there was a high level of social support. However, there were no gender-based differences in extent of social support, and the latter did not predict clinical outcomes."
19570225,No," Massimo Bilancia,","Geographical clustering of lung cancer in the province of Lecce, Italy: 1992-2001.",International journal of health geographics,2009,Epidemiology,Human,n.a.,"The triennial mortality rates for lung cancer in the two decades 1981-2001 in the province of Lecce, Italy, are significantly higher than those for the entire region of Apulia (to which the Province of Lecce belongs) and the national reference rates. Moreover, analyzing the rates in the three-year periods 1993-95, 1996-98 and 1999-01, there is a dramatic increase in mortality for both males and females, which still remains essentially unexplained: to understand the extent of this phenomenon, it is worth noting that the standardized mortality rate for males in 1999-01 is equal to 13.92 per 10000 person-years, compared to a value of 6.96 for Italy in the 2000-2002 period.These data have generated a considerable concern in the press and public opinion, which with little scientific reasoning have sometimes identified suspected culprits of the risk excess (for example, the emission caused by a number of large industrial sites located in the provinces of Brindisi and Taranto, bordering the Province of Lecce). The objective of this paper is to study on a scientifically sound basis the spatial distribution of risk for lung cancer mortality in the province of Lecce. Our goal is to demonstrate that most of the previous explanations are not supported by data: to this end, we will follow a hybrid approach that combines both frequentist and Bayesian disease mapping methods. Furthermore, we define a new sequential algorithm based on a modified version of the Besag-York-Mollié (BYM) model, suitably modified to detect geographical clusters of disease.Standardized mortality ratios (SMRs) for lung cancer in the province of Lecce: For males, the relative risk (measured by means of SMR, i.e. the ratio between observed and expected cases in each area under internal standardization) was judged to be significantly greater than 1 in many municipal areas, the significance being evaluated under the null hypothesis of neutral risk on the ground of area-specific p-values (denoted by rhoi); in addition, it was seen that high risk areas were not randomly distributed within the province, but showed a sharp clustering. The most perceptible cluster involved a collection of municipalities around the Maglie area (Istat code: 75039), while the association among the municipalities of Otranto, Poggiardo and Santa Cesarea Terme (Istat codes: 75057, 75061, 75072) was more ambiguous. For females, it was noteworthy the significant risk excess in the city of Lecce (Istat code: 75035), where an SMR of 1.83 and rhoi < 0.01 have been registered. BYM model for the province of Lecce: For males, Bayes estimates of relative risks varied around an overall mean of 1.04 with standard deviation of 0.1, with a minimum of 0.77 and a maximum of 1.25. The posterior relative risks for females, although smoothed, showed more variation than for males, ranging form 0.74 to 1.65, around a mean of 0.90 with standard deviation 0.12. For males, 95% posterior credible intervals of relative risks included unity in every area, whereas significantly elevated risk of mortality was confirmed in the Lecce area for females (95% posterior CI: 1.33 - 2.00). BYM model for the whole Apulia: For males, internally standardized maps showed several high risk areas bordering the province of Lecce, belonging to the province of Brindisi, and the presence of a large high risk region, including the southern part of the province of Brindisi and the eastern and southern part of the Salento peninsula, in which an increasing trend in the north-south direction was found.Ecological correlation study with deprivation (Cadum Index): For males, posterior mean of the ecological regression coefficient beta resulted to be 0.04 with 95% posterior credible interval equal to (-0.01, 0.08); similarly, beta was estimated as equal to -0.03 for females (95% posterior credible interval: -0.16, 0.10). Moreover, there was some indication of nonlinearly increasing relative risk with increasing deprivation for higher deprivation levels. For females, it was difficult to postulate the existence of any association between risk and deprivation.Cluster detection: cluster detection based on a modified BYM model identified two large unexplained increased risk clusters in the central-eastern and southern part of the peninsula. Other secondary clusters, which raise several complex interpretation issues, are present.Our results reduce the alleged role of the industrial facilities located around the province of Taranto: in particular, air pollution produced around the city of Taranto (which lies to the west of the province of Lecce) has been often identified as the main culprit of the mortality excess, a conclusion that was further supported by a recent study on the direction of prevailing winds on Salento. This hypothesis is contradicted by the finding that those municipalities that directly border on the province of Taranto (belonging to the so-called ""Jonico-Salentina"" band) are those that present low mortality rates (at least for males). In the same way, the responsibilities of energy production plants located in the province of Brindisi (Brindisi province lies to the north) appear to be of little relevance. For females, given the situation observed in the city of Lecce, and given the substantial increase in mortality observed in younger age classes, further investigation is required into the role played by changes in lifestyle, including greater net propensity to smoke that women have shown since the 80s onwards (a phenomenon which could be amplified in a city traditionally cultured and modern as Lecce, as the tobacco habit is a largely cultural phenomenon). For males, the presence of high levels of deprivation throughout the eastern and southern Salento is likely to play an important role: those with lower socio-economic status smoke more, and gender differences may be explained on the basis of the fact that in less developed areas women have less habit to tobacco smoking and alcohol drinking (and other harmful lifestyles), which are seen as purely masculine behaviour: research into the role of material deprivation and individual lifestyle differences between genders should be further developed."
18922127,Yes," Silvia Novello, Tiziana Vaval√†",Lung cancer and women.,"Future oncology (London, England)",2008 Oct,Review,Human,na,"In the early 1900s, lung cancer was a rare malignancy in women, but starting from the 1960s it has progressively reached epidemic proportions, surpassing breast cancer in 1987 and becoming the leading cause of cancer deaths in many countries. Retrospective data show that the 5-year survival rate for women who have lung cancer is 15.6%, compared with 12.5% for men, and this improved survival could have important implications in the design and interpretation of lung cancer trials. Women have major responses to therapy regardless of stage, therapeutic modalities or histology. The increase of lung cancer incidence among women is reflected in their clinical trial participation, causing a survival improvement and suggesting the need of stratification by sex in future studies. No specific drugs for women with lung cancer are currently available, but researchers are devoting energies in this area in order to better understand the implication of gender differences in epidemiology, pathogenesis, prognosis and tumor response."
18922127,Yes," Silvia Novello,",Lung cancer and women.,"Future oncology (London, England)",2008 Oct,Review,Human,na,"In the early 1900s, lung cancer was a rare malignancy in women, but starting from the 1960s it has progressively reached epidemic proportions, surpassing breast cancer in 1987 and becoming the leading cause of cancer deaths in many countries. Retrospective data show that the 5-year survival rate for women who have lung cancer is 15.6%, compared with 12.5% for men, and this improved survival could have important implications in the design and interpretation of lung cancer trials. Women have major responses to therapy regardless of stage, therapeutic modalities or histology. The increase of lung cancer incidence among women is reflected in their clinical trial participation, causing a survival improvement and suggesting the need of stratification by sex in future studies. No specific drugs for women with lung cancer are currently available, but researchers are devoting energies in this area in order to better understand the implication of gender differences in epidemiology, pathogenesis, prognosis and tumor response."
18457755,No," Lisa R Shugarman, Joanne Lynn",Age and gender differences in medicare expenditures and service utilization at the end of life for lung cancer decedents.,Women's health issues : official publication of the Jacobs Institute of Women's Health,2008 May-Jun,Management,Human,13120,"Gender and age differences in medical care are well documented. We examined age and gender differences in Medicare expenditures for lung cancer decedents in the last year of life (LYOL) through a cross-sectional study of Medicare administrative and claims data.Participants were aged Medicare beneficiaries (>or=68) with lung cancer, who were covered by Parts A and B for 36 months before death (1996-1999; n = 13,120). Regression techniques were used to estimate age and gender differences in mean Medicare utilization and expenditures in the LYOL overall and by type of service, conditional on use: inpatient, outpatient, physician, skilled nursing facility (SNF), home health, and hospice, controlling for demographic, clinical, geographic, and supply characteristics.Women were more likely than men to use inpatient, SNF, home health, and hospice services. Women's average expenditures were approximately dollars 1,900 greater than men's, with differences attributed to higher average expenditures for SNF, home health, and hospice. Older cohorts used fewer inpatient and outpatient services and used more SNF and hospice services in their LYOL. Average Medicare expenditures were significantly lower in older cohorts (dollars 8,487 less for those age >or=85 at death than for those 68-74). Adjusting for age explains most of the gender differences in average Medicare expenditures. Remaining gender differences vary across age cohorts, with larger gender differences in social-supportive service expenditures among those 68-74 and 75-84 and outpatient and physician services among those 75-84 and >or=85.Our findings suggest that gender disparities in expenditures are generally small at the end of life for lung cancer decedents, particularly among the older cohorts. As expected, the bigger observed differences are by age although the direction of the association is not consistent across types of service. Higher expenditures for women on social-supportive services may reflect fewer informal supports for older women compared with men."
